{
  "schema_version": "1.0-p3.1",
  "model_feature": false,
  "summary": {
    "canonical_item_count": 123,
    "verified_canonical_item_count": 44,
    "model_eligible_item_count": 19,
    "verified_alias_item_count": 0,
    "known_owned_count": 161,
    "known_missing_count": 1,
    "known_state_count": 162,
    "review_only_positive_count": 157,
    "review_only_negative_count": 3,
    "review_only_conflict_count": 0,
    "historical_cost_reference_count": 44
  },
  "items": [
    {
      "item_id": "item_anniversary_bass",
      "canonical_verification_status": "needs_review",
      "canonical_model_feature_status": "excluded_pending_verification",
      "verified_observation_token_available": false,
      "alias_count": 2,
      "verified_alias_count": 0,
      "alias_verification_gap_count": 2,
      "known_owned_count": 0,
      "known_missing_count": 0,
      "unknown_state_count": 1022,
      "review_only_positive_count": 0,
      "review_only_negative_count": 0,
      "review_only_conflict_count": 0,
      "historical_cost_reference_kind": null,
      "model_feature": false
    },
    {
      "item_id": "item_anniversary_fifth_stripe_cape",
      "canonical_verification_status": "needs_review",
      "canonical_model_feature_status": "excluded_pending_verification",
      "verified_observation_token_available": false,
      "alias_count": 3,
      "verified_alias_count": 0,
      "alias_verification_gap_count": 3,
      "known_owned_count": 5,
      "known_missing_count": 0,
      "unknown_state_count": 1017,
      "review_only_positive_count": 5,
      "review_only_negative_count": 0,
      "review_only_conflict_count": 0,
      "historical_cost_reference_kind": null,
      "model_feature": false
    },
    {
      "item_id": "item_aurora_cure_for_me_mask",
      "canonical_verification_status": "verified",
      "canonical_model_feature_status": "eligible",
      "verified_observation_token_available": false,
      "alias_count": 1,
      "verified_alias_count": 0,
      "alias_verification_gap_count": 1,
      "known_owned_count": 0,
      "known_missing_count": 0,
      "unknown_state_count": 1022,
      "review_only_positive_count": 0,
      "review_only_negative_count": 0,
      "review_only_conflict_count": 0,
      "historical_cost_reference_kind": "in_game_currency",
      "model_feature": false
    },
    {
      "item_id": "item_aurora_cure_for_me_outfit",
      "canonical_verification_status": "verified",
      "canonical_model_feature_status": "eligible",
      "verified_observation_token_available": false,
      "alias_count": 1,
      "verified_alias_count": 0,
      "alias_verification_gap_count": 1,
      "known_owned_count": 0,
      "known_missing_count": 0,
      "unknown_state_count": 1022,
      "review_only_positive_count": 0,
      "review_only_negative_count": 0,
      "review_only_conflict_count": 0,
      "historical_cost_reference_kind": "in_game_currency",
      "model_feature": false
    },
    {
      "item_id": "item_aurora_giving_in_cape",
      "canonical_verification_status": "verified",
      "canonical_model_feature_status": "eligible",
      "verified_observation_token_available": false,
      "alias_count": 0,
      "verified_alias_count": 0,
      "alias_verification_gap_count": 0,
      "known_owned_count": 0,
      "known_missing_count": 0,
      "unknown_state_count": 1022,
      "review_only_positive_count": 0,
      "review_only_negative_count": 0,
      "review_only_conflict_count": 0,
      "historical_cost_reference_kind": "exact_historical_item_price",
      "model_feature": false
    },
    {
      "item_id": "item_aurora_mindful_miner_cape",
      "canonical_verification_status": "needs_review",
      "canonical_model_feature_status": "excluded_pending_verification",
      "verified_observation_token_available": false,
      "alias_count": 0,
      "verified_alias_count": 0,
      "alias_verification_gap_count": 0,
      "known_owned_count": 0,
      "known_missing_count": 0,
      "unknown_state_count": 1022,
      "review_only_positive_count": 0,
      "review_only_negative_count": 0,
      "review_only_conflict_count": 0,
      "historical_cost_reference_kind": null,
      "model_feature": false
    },
    {
      "item_id": "item_aurora_mindful_miner_hair",
      "canonical_verification_status": "needs_review",
      "canonical_model_feature_status": "excluded_pending_verification",
      "verified_observation_token_available": false,
      "alias_count": 0,
      "verified_alias_count": 0,
      "alias_verification_gap_count": 0,
      "known_owned_count": 0,
      "known_missing_count": 0,
      "unknown_state_count": 1022,
      "review_only_positive_count": 0,
      "review_only_negative_count": 0,
      "review_only_conflict_count": 0,
      "historical_cost_reference_kind": null,
      "model_feature": false
    },
    {
      "item_id": "item_aurora_mindful_miner_mask",
      "canonical_verification_status": "needs_review",
      "canonical_model_feature_status": "excluded_pending_verification",
      "verified_observation_token_available": false,
      "alias_count": 0,
      "verified_alias_count": 0,
      "alias_verification_gap_count": 0,
      "known_owned_count": 0,
      "known_missing_count": 0,
      "unknown_state_count": 1022,
      "review_only_positive_count": 0,
      "review_only_negative_count": 0,
      "review_only_conflict_count": 0,
      "historical_cost_reference_kind": null,
      "model_feature": false
    },
    {
      "item_id": "item_aurora_mindful_miner_outfit",
      "canonical_verification_status": "needs_review",
      "canonical_model_feature_status": "excluded_pending_verification",
      "verified_observation_token_available": false,
      "alias_count": 0,
      "verified_alias_count": 0,
      "alias_verification_gap_count": 0,
      "known_owned_count": 0,
      "known_missing_count": 0,
      "unknown_state_count": 1022,
      "review_only_positive_count": 0,
      "review_only_negative_count": 0,
      "review_only_conflict_count": 0,
      "historical_cost_reference_kind": null,
      "model_feature": false
    },
    {
      "item_id": "item_aurora_runaway_music_sheet",
      "canonical_verification_status": "needs_review",
      "canonical_model_feature_status": "excluded_pending_verification",
      "verified_observation_token_available": false,
      "alias_count": 1,
      "verified_alias_count": 0,
      "alias_verification_gap_count": 1,
      "known_owned_count": 0,
      "known_missing_count": 0,
      "unknown_state_count": 1022,
      "review_only_positive_count": 0,
      "review_only_negative_count": 0,
      "review_only_conflict_count": 0,
      "historical_cost_reference_kind": null,
      "model_feature": false
    },
    {
      "item_id": "item_aurora_running_wayfarer_cape",
      "canonical_verification_status": "needs_review",
      "canonical_model_feature_status": "excluded_pending_verification",
      "verified_observation_token_available": false,
      "alias_count": 0,
      "verified_alias_count": 0,
      "alias_verification_gap_count": 0,
      "known_owned_count": 0,
      "known_missing_count": 0,
      "unknown_state_count": 1022,
      "review_only_positive_count": 0,
      "review_only_negative_count": 0,
      "review_only_conflict_count": 0,
      "historical_cost_reference_kind": null,
      "model_feature": false
    },
    {
      "item_id": "item_aurora_running_wayfarer_hair",
      "canonical_verification_status": "needs_review",
      "canonical_model_feature_status": "excluded_pending_verification",
      "verified_observation_token_available": false,
      "alias_count": 0,
      "verified_alias_count": 0,
      "alias_verification_gap_count": 0,
      "known_owned_count": 0,
      "known_missing_count": 0,
      "unknown_state_count": 1022,
      "review_only_positive_count": 0,
      "review_only_negative_count": 0,
      "review_only_conflict_count": 0,
      "historical_cost_reference_kind": null,
      "model_feature": false
    },
    {
      "item_id": "item_aurora_running_wayfarer_mask",
      "canonical_verification_status": "needs_review",
      "canonical_model_feature_status": "excluded_pending_verification",
      "verified_observation_token_available": false,
      "alias_count": 0,
      "verified_alias_count": 0,
      "alias_verification_gap_count": 0,
      "known_owned_count": 0,
      "known_missing_count": 0,
      "unknown_state_count": 1022,
      "review_only_positive_count": 0,
      "review_only_negative_count": 0,
      "review_only_conflict_count": 0,
      "historical_cost_reference_kind": null,
      "model_feature": false
    },
    {
      "item_id": "item_aurora_seed_of_hope_cape",
      "canonical_verification_status": "needs_review",
      "canonical_model_feature_status": "excluded_pending_verification",
      "verified_observation_token_available": false,
      "alias_count": 0,
      "verified_alias_count": 0,
      "alias_verification_gap_count": 0,
      "known_owned_count": 0,
      "known_missing_count": 0,
      "unknown_state_count": 1022,
      "review_only_positive_count": 0,
      "review_only_negative_count": 0,
      "review_only_conflict_count": 0,
      "historical_cost_reference_kind": null,
      "model_feature": false
    },
    {
      "item_id": "item_aurora_seed_of_hope_hair",
      "canonical_verification_status": "needs_review",
      "canonical_model_feature_status": "excluded_pending_verification",
      "verified_observation_token_available": false,
      "alias_count": 0,
      "verified_alias_count": 0,
      "alias_verification_gap_count": 0,
      "known_owned_count": 0,
      "known_missing_count": 0,
      "unknown_state_count": 1022,
      "review_only_positive_count": 0,
      "review_only_negative_count": 0,
      "review_only_conflict_count": 0,
      "historical_cost_reference_kind": null,
      "model_feature": false
    },
    {
      "item_id": "item_aurora_seed_of_hope_mask",